{
  "aliases": [
    "grok-4.5-latest",
    "grok-build-latest"
  ],
  "model": "grok-4.5",
  "provider": "xai",
  "variations": {
    "cache_read": [
      {
        "confidence": "verified",
        "from": "2026-07-08",
        "last_validated": "2026-07-09",
        "price_usd": 0.5,
        "src": "https://docs.x.ai/docs/models",
        "to": "2026-07-19",
        "unit": "usd_per_mtok"
      },
      {
        "confidence": "verified",
        "from": "2026-07-19",
        "last_validated": "2026-07-27",
        "price_usd": 0.3,
        "src": "https://docs.x.ai/developers/models",
        "to": null,
        "unit": "usd_per_mtok"
      }
    ],
    "input": [
      {
        "confidence": "verified",
        "from": "2026-07-08",
        "last_validated": "2026-07-27",
        "price_usd": 2,
        "src": "https://docs.x.ai/developers/models",
        "to": null,
        "unit": "usd_per_mtok"
      }
    ],
    "output": [
      {
        "confidence": "verified",
        "from": "2026-07-08",
        "last_validated": "2026-07-27",
        "price_usd": 6,
        "src": "https://docs.x.ai/developers/models",
        "to": null,
        "unit": "usd_per_mtok"
      }
    ],
    "tier2_input": [
      {
        "confidence": "verified",
        "from": "2026-07-31",
        "last_validated": "2026-07-31",
        "price_usd": 4,
        "src": "https://docs.x.ai/developers/models",
        "to": null,
        "unit": "usd_per_mtok"
      }
    ],
    "tier2_output": [
      {
        "confidence": "verified",
        "from": "2026-07-31",
        "last_validated": "2026-07-31",
        "price_usd": 12,
        "src": "https://docs.x.ai/developers/models",
        "to": null,
        "unit": "usd_per_mtok"
      }
    ]
  }
}
