{
  "aliases": [
    "grok-4.20-beta-0309-non-reasoning",
    "grok-4.20-beta-latest-non-reasoning",
    "grok-4.20-beta-non-reasoning",
    "grok-4.20-experimental-beta-0304-non-reasoning",
    "grok-4.20-experimental-beta-non-reasoning-latest",
    "grok-4.20-non-reasoning",
    "grok-4.20-non-reasoning-gv2",
    "grok-4.20-non-reasoning-latest"
  ],
  "model": "grok-4.20-0309-non-reasoning",
  "provider": "xai",
  "variations": {
    "cache_read": [
      {
        "confidence": "inferred",
        "from": "2026-06-22",
        "last_validated": "2026-06-22",
        "price_usd": 0.2,
        "src": "https://docs.x.ai/docs/models",
        "to": "2026-06-29",
        "unit": "usd_per_mtok"
      },
      {
        "confidence": "verified",
        "from": "2026-06-29",
        "last_validated": "2026-07-27",
        "price_usd": 0.2,
        "src": "https://docs.x.ai/developers/models",
        "to": null,
        "unit": "usd_per_mtok"
      }
    ],
    "input": [
      {
        "confidence": "inferred",
        "from": "2026-06-22",
        "last_validated": "2026-06-22",
        "price_usd": 1.25,
        "src": "https://docs.x.ai/docs/models",
        "to": "2026-06-29",
        "unit": "usd_per_mtok"
      },
      {
        "confidence": "verified",
        "from": "2026-06-29",
        "last_validated": "2026-07-27",
        "price_usd": 1.25,
        "src": "https://docs.x.ai/developers/models",
        "to": null,
        "unit": "usd_per_mtok"
      }
    ],
    "output": [
      {
        "confidence": "inferred",
        "from": "2026-06-22",
        "last_validated": "2026-06-22",
        "price_usd": 2.5,
        "src": "https://docs.x.ai/docs/models",
        "to": "2026-06-29",
        "unit": "usd_per_mtok"
      },
      {
        "confidence": "verified",
        "from": "2026-06-29",
        "last_validated": "2026-07-27",
        "price_usd": 2.5,
        "src": "https://docs.x.ai/developers/models",
        "to": null,
        "unit": "usd_per_mtok"
      }
    ],
    "tier2_input": [
      {
        "confidence": "verified",
        "from": "2026-07-31",
        "last_validated": "2026-07-31",
        "price_usd": 2.5,
        "src": "https://docs.x.ai/developers/models",
        "to": null,
        "unit": "usd_per_mtok"
      }
    ],
    "tier2_output": [
      {
        "confidence": "verified",
        "from": "2026-07-31",
        "last_validated": "2026-07-31",
        "price_usd": 5,
        "src": "https://docs.x.ai/developers/models",
        "to": null,
        "unit": "usd_per_mtok"
      }
    ]
  }
}
