{
  "aliases": [
    "grok-4.3-latest",
    "grok-latest"
  ],
  "model": "grok-4.3",
  "provider": "xai",
  "variations": {
    "cache_read": [
      {
        "confidence": "verified",
        "from": "2026-06-17",
        "last_validated": "2026-07-27",
        "price_usd": 0.2,
        "src": "https://docs.x.ai/developers/models",
        "to": null,
        "unit": "usd_per_mtok"
      }
    ],
    "input": [
      {
        "confidence": "verified",
        "from": "2026-05-05",
        "last_validated": "2026-07-27",
        "price_usd": 1.25,
        "src": "https://docs.x.ai/developers/models/grok-4.3",
        "to": null,
        "unit": "usd_per_mtok"
      }
    ],
    "output": [
      {
        "confidence": "verified",
        "from": "2026-05-05",
        "last_validated": "2026-07-27",
        "price_usd": 2.5,
        "src": "https://docs.x.ai/developers/models/grok-4.3",
        "to": null,
        "unit": "usd_per_mtok"
      }
    ]
  }
}
