{
  "aliases": [
    "grok-4.20",
    "grok-4.20-0309",
    "grok-4.20-beta",
    "grok-4.20-beta-0309",
    "grok-4.20-beta-0309-reasoning",
    "grok-4.20-beta-latest",
    "grok-4.20-beta-latest-reasoning",
    "grok-4.20-beta-reasoning",
    "grok-4.20-experimental-beta-0304",
    "grok-4.20-experimental-beta-0304-reasoning",
    "grok-4.20-experimental-beta-latest",
    "grok-4.20-experimental-beta-reasoning-latest",
    "grok-4.20-reasoning",
    "grok-4.20-reasoning-gv2",
    "grok-4.20-reasoning-latest"
  ],
  "model": "grok-4.20-0309-reasoning",
  "provider": "xai",
  "variations": {
    "cache_read": [
      {
        "confidence": "verified",
        "from": "2026-07-27",
        "last_validated": "2026-07-27",
        "price_usd": 0.2,
        "src": "https://docs.x.ai/developers/models",
        "to": null,
        "unit": "usd_per_mtok"
      }
    ],
    "input": [
      {
        "confidence": "verified",
        "from": "2026-03-09",
        "last_validated": "2026-07-27",
        "price_usd": 1.25,
        "src": "https://docs.x.ai/developers/models/grok-4.20-0309-reasoning",
        "to": null,
        "unit": "usd_per_mtok"
      }
    ],
    "output": [
      {
        "confidence": "verified",
        "from": "2026-03-09",
        "last_validated": "2026-07-27",
        "price_usd": 2.5,
        "src": "https://docs.x.ai/developers/models/grok-4.20-0309-reasoning",
        "to": null,
        "unit": "usd_per_mtok"
      }
    ],
    "tier2_cache_read": [
      {
        "confidence": "verified",
        "from": "2026-09-03",
        "last_validated": "2026-09-03",
        "price_usd": 0.4,
        "src": "https://docs.x.ai/developers/models",
        "to": null,
        "unit": "usd_per_mtok"
      }
    ],
    "tier2_input": [
      {
        "confidence": "verified",
        "from": "2026-07-31",
        "last_validated": "2026-07-31",
        "price_usd": 2.5,
        "src": "https://docs.x.ai/developers/models",
        "to": null,
        "unit": "usd_per_mtok"
      }
    ],
    "tier2_output": [
      {
        "confidence": "verified",
        "from": "2026-07-31",
        "last_validated": "2026-07-31",
        "price_usd": 5,
        "src": "https://docs.x.ai/developers/models",
        "to": null,
        "unit": "usd_per_mtok"
      }
    ]
  }
}
